{
  "id": 56,
  "name": "Reviparin",
  "description": null,
  "version": "1.0.1",
  "createdBy": "Boris Delange",
  "createdDate": "2026-02-12",
  "modifiedBy": "Boris Delange",
  "modifiedDate": "2026-04-09",
  "createdByTool": "INDICATE Data Dictionary (Web) v1.0.0",
  "expression": {
    "items": [
      {
        "concept": {
          "conceptId": 19129274,
          "conceptName": "reviparin",
          "domainId": "Drug",
          "vocabularyId": "RxNorm",
          "conceptClassId": "Ingredient",
          "standardConcept": "S",
          "standardConceptCaption": "Standard",
          "conceptCode": "75960",
          "validStartDate": "1970-01-01",
          "validEndDate": "2099-12-31",
          "invalidReason": null,
          "invalidReasonCaption": "Valid"
        },
        "isExcluded": false,
        "includeDescendants": true,
        "includeMapped": false
      }
    ]
  },
  "tags": [],
  "metadata": {
    "uniqueId": "fafca970-a4f3-4fb3-a60f-f2650c0c195a",
    "organization": {
      "created": {
        "name": "INDICATE Consortium",
        "url": "https://indicate-eu.org"
      },
      "current": {
        "name": "INDICATE Consortium",
        "url": "https://indicate-eu.org"
      }
    },
    "sourceRepo": "https://github.com/indicate-eu/data-dictionary",
    "reviewStatus": "pending_review",
    "origin": null,
    "translations": {
      "en": {
        "name": "Reviparin",
        "category": "Medications",
        "subcategory": "Anticoagulants",
        "shortDescription": null,
        "longDescription": null
      },
      "fr": {
        "name": "Reviparin",
        "category": "Médicaments",
        "subcategory": "Anticoagulants",
        "shortDescription": null,
        "longDescription": null
      }
    },
    "createdByDetails": {
      "firstName": "Boris",
      "lastName": "Delange",
      "affiliation": "Univ Rennes, CHU Rennes, INSERM, LTSI-UMR 1099, Rennes, France",
      "profession": "Medical Informatics and Intensive Care Physician",
      "orcid": "0009-0002-6055-6935"
    },
    "reviews": [
      {
        "reviewId": 1,
        "reviewer": {
          "firstName": "Mathilde",
          "lastName": "Bories",
          "affiliation": "Univ Rennes, CHU Rennes, INSERM, LTSI-UMR 1099, Rennes, France",
          "profession": "Medical Informatics and Pharmacist",
          "orcid": "0000-0001-9092-4298"
        },
        "reviewTimestamp": "2026-09-09T10:00:00.000Z",
        "status": "approved",
        "comments": "Ingredient and hierarchy reviewed; resolved list not reviewed exhaustively.",
        "version": "1.0.1"
      },
      {
        "reviewId": 2,
        "reviewer": {
          "firstName": "Gregor",
          "lastName": "Lichtner",
          "affiliation": "Universitätsmedizin Greifswald",
          "profession": "Medical Informatics",
          "orcid": ""
        },
        "reviewTimestamp": "2026-10-09T15:29:25.666Z",
        "status": "approved",
        "comments": "## Summary\n**Approved.** Used in QI05 via the ingredient hierarchy.\n\n## Use in our quality indicators\n- Used in QI05 (Thromboembolic prevention).\n- CQL: covered as a whole via the anchor concept 19129274 reviparin with descendants (OMOP hierarchy codesystem) in [`AnticoagulationDrugs.cql`](https://github.com/umg-minai/cql-indicate-qi/blob/d63eb84a308d5586fcede0b7e3fa73abf6b6761c/cql/AnticoagulationDrugs.cql?plain=1); the 487 resolved concepts were not reviewed one by one.\n\n## Suggestions\n- None.\n",
        "version": "1.0.1"
      }
    ],
    "versions": [
      {
        "version": "1.0.1",
        "date": "2026-04-09",
        "author": "Boris Delange",
        "message": "Changed concept set definition from specific Clinical Drug concepts to the RxNorm Ingredient with all descendants included."
      }
    ],
    "distributionStats": null
  }
}
