{
  "id": 4,
  "name": "Confusion Assessment Method for the Intensive Care Unit (CAM-ICU)",
  "description": "Bedside delirium diagnostic instrument adapted from the CAM for use in critically ill, including ventilated, patients",
  "version": "1.0.2",
  "createdBy": "Boris Delange",
  "createdDate": "2026-02-12",
  "modifiedBy": "Boris Delange",
  "modifiedDate": "2026-05-27",
  "createdByTool": "INDICATE Data Dictionary (Web) v1.0.1",
  "expression": {
    "items": [
      {
        "concept": {
          "conceptId": 2100000001,
          "conceptName": "Confusion Assessment Method for the Intensive Care Unit (CAM-ICU)",
          "domainId": "Measurement",
          "vocabularyId": "INDICATE",
          "conceptClassId": "Observable Entity",
          "standardConcept": "",
          "standardConceptCaption": "Non-standard",
          "conceptCode": "CAM-ICU",
          "validStartDate": "2026-03-13",
          "validEndDate": "2099-12-31",
          "invalidReason": null,
          "invalidReasonCaption": "Valid"
        },
        "isExcluded": false,
        "includeDescendants": false,
        "includeMapped": false
      }
    ]
  },
  "tags": [],
  "metadata": {
    "uniqueId": "b0a310a5-386e-426c-a90e-707909be7132",
    "organization": {
      "created": {
        "name": "INDICATE Consortium",
        "url": "https://indicate-eu.org"
      },
      "current": {
        "name": "INDICATE Consortium",
        "url": "https://indicate-eu.org"
      }
    },
    "sourceRepo": "https://github.com/indicate-eu/data-dictionary",
    "reviewStatus": "pending_review",
    "origin": null,
    "translations": {
      "en": {
        "name": "Confusion Assessment Method for the Intensive Care Unit (CAM-ICU)",
        "category": "Clinical observations",
        "subcategory": "Neurological assessment",
        "shortDescription": "Bedside delirium diagnostic instrument adapted from the CAM for use in critically ill, including ventilated, patients",
        "longDescription": "## Definition & Clinical Context\n\nThe CAM-ICU (Confusion Assessment Method for the Intensive Care Unit) is a bedside delirium diagnostic instrument adapted from the original CAM for use in critically ill patients, including those who are mechanically ventilated. It takes approximately 2 minutes to administer and does not require special training [1].\n\nThe instrument uses a two-step process. The level of consciousness is first assessed using the RASS; patients with RASS −4 or −5 (coma) cannot be evaluated. For assessable patients, four features are evaluated:\n- acute onset or fluctuating course\n- inattention\n- altered level of consciousness\n- disorganised thinking\n\nThe CAM-ICU is positive for delirium when features 1 and 2 are both present, together with feature 3 and/or feature 4.\n\n## Included Concepts\n\nThis concept set contains a single custom concept, as no equivalent exists in standard terminologies (SNOMED, LOINC).\n\n## References\n\n[1] Ely EW, Inouye SK, Bernard GR, et al. Delirium in mechanically ventilated patients: validity and reliability of the confusion assessment method for the intensive care unit (CAM-ICU). *JAMA*. 2001;286(21):2703-2710. doi:10.1001/jama.286.21.2703. PMID: <a href=\"https://pubmed.ncbi.nlm.nih.gov/11730446/\" target=\"_blank\">11730446</a>"
      },
      "fr": {
        "name": "Confusion Assessment Method for the Intensive Care Unit (CAM-ICU)",
        "category": "Observations cliniques",
        "subcategory": "Évaluation neurologique",
        "shortDescription": "Outil diagnostique du delirium au lit du patient, adapté du CAM pour les patients de réanimation, y compris ventilés",
        "longDescription": "## Définition et contexte clinique\n\nLe CAM-ICU (Confusion Assessment Method for the Intensive Care Unit) est un instrument diagnostique du délirium au lit du patient, adapté du CAM original pour une utilisation chez les patients de réanimation, y compris ceux sous ventilation mécanique. Son administration prend environ 2 minutes et ne nécessite pas de formation spécifique [1].\n\nL'instrument utilise un processus en deux étapes. Le niveau de conscience est d'abord évalué à l'aide du RASS ; les patients avec un RASS de −4 ou −5 (coma) ne peuvent pas être évalués. Pour les patients évaluables, quatre critères sont recherchés :\n- début aigu ou évolution fluctuante\n- inattention\n- altération du niveau de conscience\n- désorganisation de la pensée\n\nLe CAM-ICU est positif pour le délirium lorsque les critères 1 et 2 sont tous deux présents, accompagnés du critère 3 et/ou du critère 4.\n\n## Concepts inclus\n\nCe concept set contient un seul concept custom, aucun équivalent n'existant dans les terminologies standard (SNOMED, LOINC).\n\n## Références\n\n[1] Ely EW, Inouye SK, Bernard GR, et al. Delirium in mechanically ventilated patients: validity and reliability of the confusion assessment method for the intensive care unit (CAM-ICU). *JAMA*. 2001;286(21):2703-2710. doi:10.1001/jama.286.21.2703. PMID: <a href=\"https://pubmed.ncbi.nlm.nih.gov/11730446/\" target=\"_blank\">11730446</a>"
      }
    },
    "createdByDetails": {
      "firstName": "Boris",
      "lastName": "Delange",
      "affiliation": "Univ Rennes, CHU Rennes, INSERM, LTSI-UMR 1099, Rennes, France",
      "profession": "Medical Informatics and Intensive Care Physician",
      "orcid": "0009-0002-6055-6935"
    },
    "reviews": [
      {
        "reviewId": 1,
        "reviewer": {
          "firstName": "Gregor",
          "lastName": "Lichtner",
          "affiliation": "Universitätsmedizin Greifswald",
          "profession": "Medical Informatics",
          "orcid": ""
        },
        "reviewTimestamp": "2026-10-09T15:27:19.569Z",
        "status": "approved",
        "comments": "## Summary\n**Approved.** Used in QI07 (pain/sedation/delirium assessment). No standard OMOP concept exists for CAM-ICU; the INDICATE custom concept (>= 2,100,000,000, [issue #3](https://github.com/indicate-eu/data-dictionary/issues/3)) is acceptable as a transitional solution.\n\n## Use in our quality indicators\n- Used in QI07 (Pain, sedation, delirium).\n- CQL: all 1 concept(s) of the set are referenced in [`IndicateQi07PainSedationDelir.cql`](https://github.com/umg-minai/cql-indicate-qi/blob/d63eb84a308d5586fcede0b7e3fa73abf6b6761c/cql/IndicateQi07PainSedationDelir.cql?plain=1) ([2100000001](https://github.com/umg-minai/cql-indicate-qi/blob/d63eb84a308d5586fcede0b7e3fa73abf6b6761c/cql/IndicateQi07PainSedationDelir.cql?plain=1#L46); each ID links to its code definition).\n\n## Suggestions\n- None.\n",
        "version": "1.0.2"
      }
    ],
    "versions": [],
    "distributionStats": null
  }
}
