{
  "id": 319,
  "name": "Peak inspiratory pressure (PIP)",
  "description": "Peak inspiratory pressure (PIP) — highest airway pressure during a delivered breath, in cmH2O.",
  "version": "1.0.1",
  "createdBy": "Boris Delange",
  "createdDate": "2026-02-12",
  "modifiedBy": "Boris Delange",
  "modifiedDate": "2026-08-14",
  "createdByTool": "INDICATE Data Dictionary (Web) v1.0.0",
  "expression": {
    "items": [
      {
        "concept": {
          "conceptId": 4101694,
          "conceptName": "Peak inspiratory pressure",
          "domainId": "Measurement",
          "vocabularyId": "SNOMED",
          "conceptClassId": "Observable Entity",
          "standardConcept": "S",
          "standardConceptCaption": "Standard",
          "conceptCode": "27913002",
          "validStartDate": "2002-01-31",
          "validEndDate": "2099-12-31",
          "invalidReason": null,
          "invalidReasonCaption": "Valid"
        },
        "isExcluded": false,
        "includeDescendants": false,
        "includeMapped": false
      }
    ]
  },
  "tags": [],
  "metadata": {
    "uniqueId": "bdd98f16-0477-4567-a32e-6b4ff195f876",
    "organization": {
      "created": {
        "name": "INDICATE Consortium",
        "url": "https://indicate-eu.org"
      },
      "current": {
        "name": "INDICATE Consortium",
        "url": "https://indicate-eu.org"
      }
    },
    "sourceRepo": "https://github.com/indicate-eu/data-dictionary",
    "reviewStatus": "pending_review",
    "origin": null,
    "translations": {
      "en": {
        "name": "Peak inspiratory pressure (PIP)",
        "category": "Ventilation",
        "subcategory": "Ventilation parameters",
        "shortDescription": "Peak inspiratory pressure (PIP) — highest airway pressure during a delivered breath, in cmH2O.",
        "longDescription": "## Definition & Clinical Context\n\nPeak inspiratory pressure (PIP) is the highest airway pressure reached during the delivery of a breath by the ventilator. It reflects the combined pressure needed to overcome airway resistance and lung/chest-wall elastance; a rising PIP signals increased resistance (e.g. secretions, bronchospasm) or decreased compliance. In source data it is a single numeric value per patient-timestamp, measured by the ventilator. It is recorded in intensive care and anaesthesia for ventilated patients. It is reported in centimetres of water (cmH2O); some ventilators display mbar (1 cmH2O ≈ 0.98 mbar).\n\n## Included Concepts\n\n- *4101694 / 27913002 — Peak inspiratory pressure (SNOMED)*: the maximum airway pressure during a delivered breath.\n\n**Note on units**: reported in **cmH2O** (`44777590 / cm[H2O] — centimeter watercolumn`, UCUM), the recommended unit, with a registered cmH2O↔mbar conversion (1 cmH2O = 0.98 mbar).\n\n## Mapping Notes\n\n- Map a recorded peak inspiratory pressure (PIP, Ppeak) to *4101694 / 27913002 — Peak inspiratory pressure*.\n- **Not plateau, mean or PEEP**: plateau pressure (during an inspiratory hold), mean airway pressure and PEEP are distinct pressures in their own concept sets.\n"
      },
      "fr": {
        "name": "Pression inspiratoire de crête (Pcrête)",
        "category": "Ventilation",
        "subcategory": "Paramètres ventilatoires",
        "shortDescription": "Pression inspiratoire de pointe (PIP) — pression maximale des voies aériennes lors d’un cycle délivré, en cmH2O.",
        "longDescription": null
      }
    },
    "createdByDetails": {
      "firstName": "Boris",
      "lastName": "Delange",
      "affiliation": "Univ Rennes, CHU Rennes, INSERM, LTSI-UMR 1099, Rennes, France",
      "profession": "Medical Informatics and Intensive Care Physician",
      "orcid": "0009-0002-6055-6935"
    },
    "reviews": [
      {
        "reviewId": 1,
        "reviewer": {
          "firstName": "Maxim",
          "lastName": "Moinat",
          "affiliation": "Erasmus MC",
          "profession": "Data Engineer",
          "orcid": "0000-0001-8473-2433"
        },
        "reviewTimestamp": "2026-08-20T13:22:00.000Z",
        "status": "approved",
        "comments": "",
        "version": "1.0.0"
      },
      {
        "reviewId": 2,
        "reviewer": {
          "firstName": "Gregor",
          "lastName": "Lichtner",
          "affiliation": "Universitätsmedizin Greifswald",
          "profession": "Medical Informatics",
          "orcid": ""
        },
        "reviewTimestamp": "2026-10-09T15:31:58.088Z",
        "status": "approved",
        "comments": "## Summary\n**Approved.** Used in QI01 as second fallback code for the inspiratory pressure (4101694, after 4215838).\n\n## Use in our quality indicators\n- Used in QI01 (Lung-protective ventilation in ARDS).\n- CQL: all 1 concept(s) of the set are referenced in [`IndicateQi01Ventilation.cql`](https://github.com/umg-minai/cql-indicate-qi/blob/d63eb84a308d5586fcede0b7e3fa73abf6b6761c/cql/IndicateQi01Ventilation.cql?plain=1) ([4101694](https://github.com/umg-minai/cql-indicate-qi/blob/d63eb84a308d5586fcede0b7e3fa73abf6b6761c/cql/IndicateQi01Ventilation.cql?plain=1#L76); each ID links to its code definition).\n\n## Decision trail\n- 2026-01-12 · Sebastian Gibb (clinician): Priority information added to the QI01 mapping ([PEEP: 42527140 total measured > 4216746 setting > 4353713 generic](https://github.com/umg-minai/indicate-qi-definitions/blob/8014d1e86ebee84856c8163ac1f98e54061cd24b/qi01-ventilation.md?plain=1#L192); [Vt: 44782826 inspiratory > 4108448 spontaneous > 3012410 setting > 4029625 generic](https://github.com/umg-minai/indicate-qi-definitions/blob/8014d1e86ebee84856c8163ac1f98e54061cd24b/qi01-ventilation.md?plain=1#L198); [Pinsp 4215838 before PIP 4101694](https://github.com/umg-minai/indicate-qi-definitions/blob/8014d1e86ebee84856c8163ac1f98e54061cd24b/qi01-ventilation.md?plain=1#L196); rule in the [mapping notes](https://github.com/umg-minai/indicate-qi-definitions/blob/8014d1e86ebee84856c8163ac1f98e54061cd24b/qi01-ventilation.md?plain=1#L169)). — [QI commit 26ca861](https://github.com/umg-minai/indicate-qi-definitions/commit/26ca861af085ba7c1f0d7f30ca2302eb417de259)\n- 2026-02-11 · Jan Moringen (implementation): Inspiratory-pressure fallback implemented with the codes 4215838 (Pinsp) and 4101694 (PIP, mmHg→cmH2O). — [CQL commit 479c102](https://github.com/umg-minai/cql-indicate-qi/commit/479c102447d5851deaababa68ca1df55e955fbcc)\n- 2026-08-20 · Maxim Moinat (Erasmus MC data engineer): Approved FiO2, PIP, Pplat (v1.1.0), Vt (v1.1.0), VCO2. — [DD review tab](https://indicate-eu.github.io/data-dictionary/#/concept-sets?id=301&tab=review)\n\n## Suggestions\n- None.\n",
        "version": "1.0.1"
      }
    ],
    "versions": [
      {
        "version": "1.0.1",
        "date": "2026-08-14",
        "author": "Boris Delange",
        "message": "Drop the conversion instruction from the mapping notes: the conversion is registered in unit_conversions.json and applied by the SQL export, so restating it as a manual step is redundant."
      }
    ],
    "distributionStats": null
  }
}
