{
  "id": 1,
  "name": "3-minute Diagnostic Interview for CAM-defined Delirium (3D-CAM)",
  "description": "Brief structured bedside diagnostic interview operationalising the CAM algorithm for delirium in hospitalised patients",
  "version": "1.0.2",
  "createdBy": "Boris Delange",
  "createdDate": "2026-02-12",
  "modifiedBy": "Boris Delange",
  "modifiedDate": "2026-05-27",
  "createdByTool": "INDICATE Data Dictionary (Web) v1.0.1",
  "expression": {
    "items": [
      {
        "concept": {
          "conceptId": 2100000000,
          "conceptName": "3-minute Diagnostic Interview for CAM-defined Delirium (3D-CAM)",
          "domainId": "Measurement",
          "vocabularyId": "INDICATE",
          "conceptClassId": "Observable Entity",
          "standardConcept": "",
          "standardConceptCaption": "Non-standard",
          "conceptCode": "3D-CAM",
          "validStartDate": "2026-03-13",
          "validEndDate": "2099-12-31",
          "invalidReason": null,
          "invalidReasonCaption": "Valid"
        },
        "isExcluded": false,
        "includeDescendants": false,
        "includeMapped": false
      }
    ]
  },
  "tags": [],
  "metadata": {
    "uniqueId": "e29ddfbd-19ce-4eaa-b6b5-ab7f453682b3",
    "organization": {
      "created": {
        "name": "INDICATE Consortium",
        "url": "https://indicate-eu.org"
      },
      "current": {
        "name": "INDICATE Consortium",
        "url": "https://indicate-eu.org"
      }
    },
    "sourceRepo": "https://github.com/indicate-eu/data-dictionary",
    "reviewStatus": "pending_review",
    "origin": null,
    "translations": {
      "en": {
        "name": "3-minute Diagnostic Interview for CAM-defined Delirium (3D-CAM)",
        "category": "Clinical observations",
        "subcategory": "Neurological assessment",
        "shortDescription": "Brief structured bedside diagnostic interview operationalising the CAM algorithm for delirium in hospitalised patients",
        "longDescription": "## Definition & Clinical Context\n\nThe 3D-CAM (3-Minute Diagnostic Assessment for CAM-defined Delirium) is a brief, structured bedside diagnostic instrument that operationalises the Confusion Assessment Method (CAM) algorithm for identifying delirium in hospitalised patients. It takes a median of 3 minutes to administer (IQR 2–5 minutes) and does not require special training [1].\n\nThe instrument comprises 20 items organised into the four CAM diagnostic features:\n- acute onset and fluctuating course\n- inattention\n- disorganised thinking\n- altered level of consciousness\n\nA feature is considered present if any single item within that category is positive. Delirium is diagnosed when features 1 and 2 are both present, along with feature 3 and/or feature 4.\n\n## Included Concepts\n\nThis concept set contains a single custom concept, as no equivalent exists in standard terminologies (SNOMED, LOINC).\n\n## References\n\n[1] Marcantonio ER, Ngo LH, O'Connor M, et al. 3D-CAM: Derivation and Validation of a 3-Minute Diagnostic Interview for CAM-Defined Delirium. *Ann Intern Med*. 2014;161(8):554-561. doi:10.7326/M14-0865. PMID: <a href=\"https://pubmed.ncbi.nlm.nih.gov/25329203/\" target=\"_blank\">25329203</a>"
      },
      "fr": {
        "name": "3-minute Diagnostic Interview for CAM-defined Delirium (3D-CAM)",
        "category": "Observations cliniques",
        "subcategory": "Évaluation neurologique",
        "shortDescription": "Entretien diagnostique structuré court au lit du patient, opérationnalisant l'algorithme CAM pour le delirium chez les patients hospitalisés",
        "longDescription": "## Définition et contexte clinique\n\nLe 3D-CAM (3-Minute Diagnostic Assessment for CAM-defined Delirium) est un instrument diagnostique structuré et bref, réalisable au lit du patient, basé sur l'algorithme de la Confusion Assessment Method (CAM) pour identifier le délirium chez les patients hospitalisés. Son administration prend en médiane 3 minutes (IQR 2–5 minutes) et ne nécessite pas de formation spécifique [1].\n\nL'instrument comprend 20 items organisés selon les quatre critères diagnostiques du CAM :\n- début aigu et évolution fluctuante\n- inattention\n- désorganisation de la pensée\n- altération du niveau de conscience\n\nUn critère est considéré comme présent si au moins un item de cette catégorie est positif. Le délirium est diagnostiqué lorsque les critères 1 et 2 sont tous deux présents, accompagnés du critère 3 et/ou du critère 4.\n\n## Concepts inclus\n\nCe concept set contient un seul concept custom, aucun équivalent n'existant dans les terminologies standard (SNOMED, LOINC).\n\n## Références\n\n[1] Marcantonio ER, Ngo LH, O'Connor M, et al. 3D-CAM: Derivation and Validation of a 3-Minute Diagnostic Interview for CAM-Defined Delirium. *Ann Intern Med*. 2014;161(8):554-561. doi:10.7326/M14-0865. PMID: <a href=\"https://pubmed.ncbi.nlm.nih.gov/25329203/\" target=\"_blank\">25329203</a>"
      }
    },
    "createdByDetails": {
      "firstName": "Boris",
      "lastName": "Delange",
      "affiliation": "Univ Rennes, CHU Rennes, INSERM, LTSI-UMR 1099, Rennes, France",
      "profession": "Medical Informatics and Intensive Care Physician",
      "orcid": "0009-0002-6055-6935"
    },
    "reviews": [
      {
        "reviewId": 1,
        "reviewer": {
          "firstName": "Gregor",
          "lastName": "Lichtner",
          "affiliation": "Universitätsmedizin Greifswald",
          "profession": "Medical Informatics",
          "orcid": ""
        },
        "reviewTimestamp": "2026-10-09T15:26:11.777Z",
        "status": "approved",
        "comments": "## Summary\n**Approved.** Used in QI07 (pain/sedation/delirium assessment). No standard OMOP concept exists for 3D-CAM; the INDICATE custom concept (>= 2,100,000,000, [issue #3](https://github.com/indicate-eu/data-dictionary/issues/3)) is acceptable as a transitional solution.\n\n## Use in our quality indicators\n- Used in QI07 (Pain, sedation, delirium).\n- CQL: all 1 concept(s) of the set are referenced in [`IndicateQi07PainSedationDelir.cql`](https://github.com/umg-minai/cql-indicate-qi/blob/d63eb84a308d5586fcede0b7e3fa73abf6b6761c/cql/IndicateQi07PainSedationDelir.cql?plain=1) ([2100000000](https://github.com/umg-minai/cql-indicate-qi/blob/d63eb84a308d5586fcede0b7e3fa73abf6b6761c/cql/IndicateQi07PainSedationDelir.cql?plain=1#L44); each ID links to its code definition).\n\n## Suggestions\n- None.\n",
        "version": "1.0.2"
      }
    ],
    "versions": [],
    "distributionStats": null
  }
}
