{
  "id": 311,
  "name": "Carbon dioxide production (VCO2)",
  "description": "CO2 production (VCO2) — volume of CO2 exhaled per minute, in L/min (absolute, not body-indexed).",
  "version": "1.0.0",
  "createdBy": "Boris Delange",
  "createdDate": "2026-02-12",
  "modifiedBy": "Boris Delange",
  "modifiedDate": "2026-02-12",
  "createdByTool": "INDICATE Data Dictionary (Web) v1.0.0",
  "expression": {
    "items": [
      {
        "concept": {
          "conceptId": 21490580,
          "conceptName": "Carbon dioxide production (VCO2) in Respiratory system",
          "domainId": "Measurement",
          "vocabularyId": "LOINC",
          "conceptClassId": "Clinical Observation",
          "standardConcept": "S",
          "standardConceptCaption": "Standard",
          "conceptCode": "60825-7",
          "validStartDate": "2016-06-24",
          "validEndDate": "2099-12-31",
          "invalidReason": null,
          "invalidReasonCaption": "Valid"
        },
        "isExcluded": false,
        "includeDescendants": false,
        "includeMapped": false
      }
    ]
  },
  "tags": [],
  "metadata": {
    "uniqueId": "90d1d0cb-5675-47f0-b9d6-51141a87c7ca",
    "organization": {
      "created": {
        "name": "INDICATE Consortium",
        "url": "https://indicate-eu.org"
      },
      "current": {
        "name": "INDICATE Consortium",
        "url": "https://indicate-eu.org"
      }
    },
    "sourceRepo": "https://github.com/indicate-eu/data-dictionary",
    "reviewStatus": "pending_review",
    "origin": null,
    "translations": {
      "en": {
        "name": "Carbon dioxide production (VCO2)",
        "category": "Ventilation",
        "subcategory": "Ventilation parameters",
        "shortDescription": "CO2 production (VCO2) — volume of CO2 exhaled per minute, in L/min (absolute, not body-indexed).",
        "longDescription": "## Definition & Clinical Context\n\nCarbon dioxide production (VCO2) is the volume of carbon dioxide a patient's body produces and exhales per unit time, a marker of metabolic rate. It is measured by analysing the patient's exhaled gas, typically by a ventilator's volumetric capnography or a metabolic (indirect calorimetry) module. In source data it is a single numeric value per patient-timestamp, reported in litres per minute (**L/min**) [1]. It is recorded in intensive care and anaesthesia, mainly for ventilated patients and during indirect calorimetry.\n\n## Included Concepts\n\nThis set contains the single LOINC concept for absolute carbon dioxide production:\n\n- *21490580 / 60825-7 — Carbon dioxide production (VCO2) in Respiratory system (LOINC)*: VCO2 in L/min.\n\n**Note on units**: reported in **`8698 / L/min — liter per minute` (UCUM)**, the recommended unit.\n\n## Mapping Notes\n\n- Map a recorded VCO2 value (in L/min, or mL/min after conversion) to *21490580 / 60825-7 — Carbon dioxide production (VCO2) in Respiratory system*.\n- **Absolute vs indexed**: this set is the absolute VCO2 (L/min). Body-size–indexed variants (VCO2 per body surface area or per ideal body weight) have different units and are not part of this set.\n- **Not the ventilatory equivalent**: the ventilatory equivalent for CO2 (minute volume divided by VCO2, used in exercise testing) is a different measurement and does not map here."
      },
      "fr": {
        "name": "Production de CO2 (VCO2)",
        "category": "Ventilation",
        "subcategory": "Paramètres ventilatoires",
        "shortDescription": "Production de CO2 (VCO2) — volume de CO2 expiré par minute, en L/min (absolu, non indexé).",
        "longDescription": null
      }
    },
    "createdByDetails": {
      "firstName": "Boris",
      "lastName": "Delange",
      "affiliation": "Univ Rennes, CHU Rennes, INSERM, LTSI-UMR 1099, Rennes, France",
      "profession": "Medical Informatics and Intensive Care Physician",
      "orcid": "0009-0002-6055-6935"
    },
    "reviews": [
      {
        "reviewId": 1,
        "reviewer": {
          "firstName": "Maxim",
          "lastName": "Moinat",
          "affiliation": "Erasmus MC",
          "profession": "Data Engineer",
          "orcid": "0000-0001-8473-2433"
        },
        "reviewTimestamp": "2026-08-20T13:22:00.000Z",
        "status": "approved",
        "comments": "",
        "version": "1.0.0"
      },
      {
        "reviewId": 2,
        "reviewer": {
          "firstName": "Gregor",
          "lastName": "Lichtner",
          "affiliation": "Universitätsmedizin Greifswald",
          "profession": "Medical Informatics",
          "orcid": ""
        },
        "reviewTimestamp": "2026-10-09T15:31:20.608Z",
        "status": "approved",
        "comments": "## Summary\n**Approved.** Used in QI03 (21490580) as optional input for the calorie target.\n\n## Use in our quality indicators\n- Used in QI03 (Feeding).\n- CQL: all 1 concept(s) of the set are referenced in [`IndicateQi03Feeding.cql`](https://github.com/umg-minai/cql-indicate-qi/blob/d63eb84a308d5586fcede0b7e3fa73abf6b6761c/cql/IndicateQi03Feeding.cql?plain=1) ([21490580](https://github.com/umg-minai/cql-indicate-qi/blob/d63eb84a308d5586fcede0b7e3fa73abf6b6761c/cql/IndicateQi03Feeding.cql?plain=1#L37); each ID links to its code definition).\n\n## Decision trail\n- 2026-01-11 / 2026-01-17 · Sebastian Gibb (clinician): VCO2 dropped because absent from the minimal dataset (11.1.), re-added as optional input (17.1.). — [OP #20144 / QI commits 7f7c67a, 3c5b692](https://github.com/umg-minai/indicate-qi-definitions/commit/3c5b692e5f7c395eef142f4bc87b7014200af82e)\n- 2026-08-20 · Maxim Moinat (Erasmus MC data engineer): Approved FiO2, PIP, Pplat (v1.1.0), Vt (v1.1.0), VCO2. — [DD review tab](https://indicate-eu.github.io/data-dictionary/#/concept-sets?id=301&tab=review)\n\n## Suggestions\n- None.\n",
        "version": "1.0.0"
      }
    ],
    "versions": [],
    "distributionStats": null
  }
}
